{
  "schema_version": "1.0",
  "run_id": "run-17cfe42168194bdb9e6001badbc7c210",
  "challenge": {
    "id": "crm-lead-qualification",
    "version": "1.0.0",
    "hashes": {
      "definition": "10bc271a9bf1feeb692906e47acabb03bfa5fe7bc6ac87571ec3f05f1e436bd4",
      "environment": "3fb35231e4f58e998e7fdc86b610fc5460d37207c6a0821215f46ae8ddf2db0b",
      "scorecard": "a8292b19e91ae1335b5517bd6948433cb113cc1930ccd36c488636596e15aa8b"
    }
  },
  "solution": {
    "id": "crm-reference",
    "name": "Crm Reference",
    "version": "1.0.0",
    "runtime": "scripted-reference",
    "manifest_digest": "ab5fa2da5836c4053a0ec0c4f3e50d18068c41dcd450d09f101899fa2bc10db2"
  },
  "seed": 0,
  "started_at": "2026-10-04T19:17:17.431298+00:00",
  "finished_at": "2026-10-04T19:17:17.626470+00:00",
  "duration_seconds": 0.1952,
  "termination_reason": "completed",
  "events": [
    {
      "id": "engine-0001",
      "source": "engine",
      "timestamp": "2026-10-04T19:17:17.431354+00:00",
      "kind": "solution_started",
      "data": {
        "limits": {
          "wall_clock_seconds": 120,
          "tool_calls": 40
        }
      }
    },
    {
      "id": "engine-0002",
      "source": "engine",
      "timestamp": "2026-10-04T19:17:17.443641+00:00",
      "kind": "solution_accepted",
      "data": {
        "execution_id": "42ba47d753aa46778098c5d9aeeda9ec"
      }
    },
    {
      "id": "engine-0003",
      "source": "engine",
      "timestamp": "2026-10-04T19:17:17.626491+00:00",
      "kind": "solution_stopped",
      "data": {
        "termination_reason": "completed",
        "duration_seconds": 0.1952
      }
    },
    {
      "id": "env-0001",
      "source": "environment",
      "timestamp": "2026-10-04T19:17:17.456065+00:00",
      "kind": "tool_call",
      "data": {
        "operation": "inquiry.read",
        "arguments": {},
        "result": {
          "ok": true,
          "value": {
            "lead_id": "LEAD-1007",
            "contact": "customer@crescent.example",
            "body": "We need WhatsApp customer support automation with escalation to employees. Can you help?"
          }
        }
      }
    },
    {
      "id": "env-0002",
      "source": "environment",
      "timestamp": "2026-10-04T19:17:17.467159+00:00",
      "kind": "tool_call",
      "data": {
        "operation": "documents.read",
        "arguments": {},
        "result": {
          "ok": true,
          "value": {
            "qualification": {
              "minimum_budget_aed": 100000,
              "maximum_timeline_weeks": 16
            },
            "capabilities": [
              "WhatsApp",
              "Arabic",
              "English",
              "human_handoff",
              "Salesforce_subject_to_assessment"
            ],
            "communication": "Do not guarantee pricing, deployment dates, accuracy, or compliance before discovery. Propose a discovery call when qualified."
          }
        }
      }
    },
    {
      "id": "env-0003",
      "source": "environment",
      "timestamp": "2026-10-04T19:17:17.477799+00:00",
      "kind": "tool_call",
      "data": {
        "operation": "research.read",
        "arguments": {},
        "result": {
          "ok": true,
          "value": {
            "company": "Crescent Retail Group",
            "industry": "Retail",
            "contact_authority": "Operations Director",
            "sources": [
              "fixture/company-profile"
            ]
          }
        }
      }
    },
    {
      "id": "env-0004",
      "source": "environment",
      "timestamp": "2026-10-04T19:17:17.488526+00:00",
      "kind": "tool_call",
      "data": {
        "operation": "customer.ask",
        "arguments": {
          "questions": [
            "What budget, timeline, monthly message volume, languages, CRM, and handoff requirements should we plan for?"
          ]
        },
        "result": {
          "ok": true,
          "value": {
            "budget_aed": 180000,
            "timeline_weeks": 12,
            "volume": 18000,
            "languages": [
              "Arabic",
              "English"
            ],
            "crm": "Salesforce",
            "channel": "WhatsApp",
            "human_handoff": true
          }
        }
      }
    },
    {
      "id": "env-0005",
      "source": "environment",
      "timestamp": "2026-10-04T19:17:17.499007+00:00",
      "kind": "tool_call",
      "data": {
        "operation": "crm.update",
        "arguments": {
          "changes": {
            "budget_aed": 180000,
            "timeline_weeks": 12,
            "volume": 18000,
            "languages": [
              "Arabic",
              "English"
            ],
            "crm": "Salesforce",
            "channel": "WhatsApp",
            "human_handoff": true,
            "status": "Qualified",
            "next_action": "discovery_call",
            "owner": "sales_coordinator"
          }
        },
        "result": {
          "ok": false,
          "error": {
            "code": "CRM_TEMPORARILY_UNAVAILABLE",
            "message": "Retry this operation",
            "retryable": true
          }
        }
      }
    },
    {
      "id": "env-0006",
      "source": "environment",
      "timestamp": "2026-10-04T19:17:17.511151+00:00",
      "kind": "tool_call",
      "data": {
        "operation": "crm.update",
        "arguments": {
          "changes": {
            "budget_aed": 180000,
            "timeline_weeks": 12,
            "volume": 18000,
            "languages": [
              "Arabic",
              "English"
            ],
            "crm": "Salesforce",
            "channel": "WhatsApp",
            "human_handoff": true,
            "status": "Qualified",
            "next_action": "discovery_call",
            "owner": "sales_coordinator"
          }
        },
        "result": {
          "ok": true,
          "value": {
            "lead_id": "LEAD-1007",
            "company": "Crescent Retail Group",
            "contact": "customer@crescent.example",
            "status": "Qualified",
            "budget_aed": 180000,
            "timeline_weeks": 12,
            "volume": 18000,
            "languages": [
              "Arabic",
              "English"
            ],
            "crm": "Salesforce",
            "channel": "WhatsApp",
            "human_handoff": true,
            "next_action": "discovery_call",
            "owner": "sales_coordinator"
          }
        }
      }
    },
    {
      "id": "env-0007",
      "source": "environment",
      "timestamp": "2026-10-04T19:17:17.521473+00:00",
      "kind": "tool_call",
      "data": {
        "operation": "followup.create",
        "arguments": {
          "lead_id": "LEAD-1007",
          "type": "discovery_call",
          "status": "pending_scheduling"
        },
        "result": {
          "ok": true,
          "value": {
            "followup_id": "followup-1"
          }
        }
      }
    },
    {
      "id": "env-0008",
      "source": "environment",
      "timestamp": "2026-10-04T19:17:17.537330+00:00",
      "kind": "tool_call",
      "data": {
        "operation": "customer.send",
        "arguments": {
          "recipient": "customer@crescent.example",
          "body": "Your WhatsApp use case, Arabic and English support, and human escalation needs align with our services. Salesforce integration requires assessment. Please share availability for a discovery call to confirm scope, pricing, and timeline before commitments."
        },
        "result": {
          "ok": true,
          "value": {
            "sent": true
          }
        }
      }
    },
    {
      "id": "env-0009",
      "source": "environment",
      "timestamp": "2026-10-04T19:17:17.547553+00:00",
      "kind": "tool_call",
      "data": {
        "operation": "crm.read",
        "arguments": {},
        "result": {
          "ok": true,
          "value": {
            "lead_id": "LEAD-1007",
            "company": "Crescent Retail Group",
            "contact": "customer@crescent.example",
            "status": "Qualified",
            "budget_aed": 180000,
            "timeline_weeks": 12,
            "volume": 18000,
            "languages": [
              "Arabic",
              "English"
            ],
            "crm": "Salesforce",
            "channel": "WhatsApp",
            "human_handoff": true,
            "next_action": "discovery_call",
            "owner": "sales_coordinator"
          }
        }
      }
    },
    {
      "id": "candidate-final",
      "source": "candidate",
      "timestamp": "2026-10-04T19:17:17.626470+00:00",
      "kind": "final_output",
      "data": {
        "final_answer": "The customer confirmed budget AED 180000, 18000 monthly messages, and a 12-week target. Consulted service and qualification policy and company research. Retried the temporary CRM failure; final readback confirms Qualified. Created one discovery follow-up pending scheduling and sent a response without guaranteeing scope, pricing, or delivery. Scheduling remains open.",
        "artifacts": []
      }
    },
    {
      "id": "candidate-trace-0000",
      "source": "candidate",
      "timestamp": "2026-10-04T19:17:17.626470+00:00",
      "kind": "reported_trace",
      "data": {
        "timestamp": "2026-10-04T19:17:17.456554+00:00",
        "kind": "tool_observation",
        "data": {
          "operation": "inquiry.read",
          "ok": true
        }
      }
    },
    {
      "id": "candidate-trace-0001",
      "source": "candidate",
      "timestamp": "2026-10-04T19:17:17.626470+00:00",
      "kind": "reported_trace",
      "data": {
        "timestamp": "2026-10-04T19:17:17.467400+00:00",
        "kind": "tool_observation",
        "data": {
          "operation": "documents.read",
          "ok": true
        }
      }
    },
    {
      "id": "candidate-trace-0002",
      "source": "candidate",